A1: THE VALPSAR (MALAYSIA) CORPORATION SDN. BHD.
A2: Mr Li Xin Yuan
A5: BẢNG TỔNG HỢP THU NHẬP CHỊU THUẾ VÀ THUẾ PHẢI NỘP - TỪ NGÀY 1/7/2005 ĐẾN NGÀY 30/6/2006
A6: DETAILED SUMMARY OF TAXABLE INCOME AND TAX PAYABLE FOR THE PERIOD FROM 1 JULY 2005 TO 30 JUNE 2006
A9: Tháng Month | D9: Thu nhập chịu thuế, trong đó | I9: Tổng thu nhập chịu thuế Total taxable income | J9: Tiền nhà | K9: TN bình quân | L9: Số thuế phải | M9: Số thuế đã | N9: Số thuế còn
B10: Tỷ giá | D10: Taxable income, of which | J10: chịu thuế | K10: chịu thuế | L10: nộp hàng tháng | M10: nộp hàng tháng | N10: phải nộp
B11: Ex-rate | D11: Lương | F11: Trợ cấp | J11: Taxable housing | K11: Average monthly | L11: Monthly tax | M11: Monthly tax | N11: Remaining
D12: Basic salary | F12: Allowance | J12: benefit | K12: taxable income | L12: payable | M12: paid | N12: PIT payable
B13: (1) | D13: (2) | F13: (3) | I13: (4)=(2)+(3) | J13: (5) | K13: (6)= Average of (4) | L13: (7) | M13: (8) | N13: (9)=(7)-(8)
B14: (USD/VND) | C14: (RMB/VND) | D14: RMB | E14: VND | F14: USD | G14: RMB | H14: VND | I14: VND | J14: VND | K14: VND | L14: VND | M14: VND | N14: VND
A16: 7/2005 | B16: 15840 | C16: 2041.6 | D16: 2000 | E16: =C16*D16 -> 4083200 | F16: 540.00 | G16: 1050 | H16: =F16*B16+G16*C16 -> 10697280 | I16: =E16+H16 -> 14780480 | J16: 0 | K16: =($I$29+$J$29)/12 -> 16253222.791666666 | L16: =ROUND(IF(K16<8000000,0,IF(K16<=20000000,K16*0.1-800000,IF(K16<=50000000,K16*0.2-2800000,IF(K16<=80000000,K16*0.3-7800000,K16*40%-15800000)))),0) -> 825322 | M16: ='Tax paid-2005'!D14 -> 678210 | N16: =L16-M16 -> 147112
A17: 8/2005 | B17: 15837 | C17: 1963.82 | D17: 2000 | E17: =C17*D17 -> 3927640 | F17: 540.00 | G17: 1050 | H17: =F17*B17+G17*C17 -> 10613991 | I17: =E17+H17 -> 14541631 | J17: 0 | K17: =($I$29+$J$29)/12 -> 16253222.791666666 | L17: =ROUND(IF(K17<8000000,0,IF(K17<=20000000,K17*0.1-800000,IF(K17<=50000000,K17*0.2-2800000,IF(K17<=80000000,K17*0.3-7800000,K17*40%-15800000)))),0) -> 825322 | M17: ='Tax paid-2005'!D15 -> 656959 | N17: =L17-M17 -> 168363
A18: 9/2005 | B18: 15854 | C18: 1968.38 | D18: 2000 | E18: =C18*D18 -> 3936760 | F18: 540.00 | G18: 1050 | H18: =F18*B18+G18*C18 -> 10627959 | I18: =E18+H18 -> 14564719 | J18: 0 | K18: =($I$29+$J$29)/12 -> 16253222.791666666 | L18: =ROUND(IF(K18<8000000,0,IF(K18<=20000000,K18*0.1-800000,IF(K18<=50000000,K18*0.2-2800000,IF(K18<=80000000,K18*0.3-7800000,K18*40%-15800000)))),0) -> 825322 | M18: ='Tax paid-2005'!D16 -> 658956 | N18: =L18-M18 -> 166366
A19: 10/2005 | B19: 15861 | C19: 1969.44 | D19: 2000 | E19: =C19*D19 -> 3938880 | F19: 540.00 | G19: 1050 | H19: =F19*B19+G19*C19 -> 10632852 | I19: =E19+H19 -> 14571732 | J19: 0 | K19: =($I$29+$J$29)/12 -> 16253222.791666666 | L19: =ROUND(IF(K19<8000000,0,IF(K19<=20000000,K19*0.1-800000,IF(K19<=50000000,K19*0.2-2800000,IF(K19<=80000000,K19*0.3-7800000,K19*40%-15800000)))),0) -> 825322 | M19: ='Tax paid-2005'!D17 -> 659495 | N19: =L19-M19 -> 165827
A20: 11/2005 | B20: 15869 | C20: 1970.03 | D20: 2000 | E20: =C20*D20 -> 3940060 | F20: 540.00 | G20: 1050 | H20: =F20*B20+G20*C20 -> 10637791.5 | I20: =E20+H20 -> 14577851.5 | J20: 0 | K20: =($I$29+$J$29)/12 -> 16253222.791666666 | L20: =ROUND(IF(K20<8000000,0,IF(K20<=20000000,K20*0.1-800000,IF(K20<=50000000,K20*0.2-2800000,IF(K20<=80000000,K20*0.3-7800000,K20*40%-15800000)))),0) -> 825322 | M20: ='Tax paid-2005'!D18 -> 659783 | N20: =L20-M20 -> 165539
A21: 12/2005 | B21: 15872 | C21: 1971.6 | D21: 2000 | E21: =C21*D21 -> 3943200 | F21: 540.00 | G21: 1050 | H21: =F21*B21+G21*C21 -> 10641060 | I21: =E21+H21 -> 14584260 | J21: 0 | K21: =($I$29+$J$29)/12 -> 16253222.791666666 | L21: =ROUND(IF(K21<8000000,0,IF(K21<=20000000,K21*0.1-800000,IF(K21<=50000000,K21*0.2-2800000,IF(K21<=80000000,K21*0.3-7800000,K21*40%-15800000)))),0) -> 825322 | M21: ='Tax paid-2005'!D19 -> 659823 | N21: =L21-M21 -> 165499
A22: 1/2006 | D22: 0 | E22: 4000000 | F22: 0 | G22: 0 | H22: 13903000 | I22: =E22+H22 -> 17903000 | J22: 0 | K22: =($I$29+$J$29)/12 -> 16253222.791666666 | L22: =ROUND(IF(K22<8000000,0,IF(K22<=20000000,K22*0.1-800000,IF(K22<=50000000,K22*0.2-2800000,IF(K22<=80000000,K22*0.3-7800000,K22*40%-15800000)))),0) -> 825322 | M22: ='Tax paid-2005'!D20 -> 661909 | N22: =L22-M22 -> 163413
A23: 2/2006 | D23: 0 | E23: 4000000 | F23: 0 | G23: 0 | H23: 13903000 | I23: =E23+H23 -> 17903000 | J23: 0 | K23: =($I$29+$J$29)/12 -> 16253222.791666666 | L23: =ROUND(IF(K23<8000000,0,IF(K23<=20000000,K23*0.1-800000,IF(K23<=50000000,K23*0.2-2800000,IF(K23<=80000000,K23*0.3-7800000,K23*40%-15800000)))),0) -> 825322 | M23: ='Tax paid-2005'!D21 -> 661909 | N23: =L23-M23 -> 163413
A24: 3/2006 | D24: 0 | E24: 4000000 | F24: 0 | G24: 0 | H24: 13903000 | I24: =E24+H24 -> 17903000 | J24: 0 | K24: =($I$29+$J$29)/12 -> 16253222.791666666 | L24: =ROUND(IF(K24<8000000,0,IF(K24<=20000000,K24*0.1-800000,IF(K24<=50000000,K24*0.2-2800000,IF(K24<=80000000,K24*0.3-7800000,K24*40%-15800000)))),0) -> 825322 | M24: ='Tax paid-2005'!D22 -> 661908 | N24: =L24-M24 -> 163414
A25: 4/2006 | D25: 0 | E25: 4000000 | F25: 0 | G25: 0 | H25: 13903000 | I25: =E25+H25 -> 17903000 | J25: 0 | K25: =($I$29+$J$29)/12 -> 16253222.791666666 | L25: =ROUND(IF(K25<8000000,0,IF(K25<=20000000,K25*0.1-800000,IF(K25<=50000000,K25*0.2-2800000,IF(K25<=80000000,K25*0.3-7800000,K25*40%-15800000)))),0) -> 825322 | M25: ='Tax paid-2005'!D23 -> 681477 | N25: =L25-M25 -> 143845
A26: 5/2006 | D26: 0 | E26: 4000000 | F26: 0 | G26: 0 | H26: 13903000 | I26: =E26+H26 -> 17903000 | J26: 0 | K26: =($I$29+$J$29)/12 -> 16253222.791666666 | L26: =ROUND(IF(K26<8000000,0,IF(K26<=20000000,K26*0.1-800000,IF(K26<=50000000,K26*0.2-2800000,IF(K26<=80000000,K26*0.3-7800000,K26*40%-15800000)))),0) -> 825322 | M26: ='Tax paid-2005'!D24 -> 676372 | N26: =L26-M26 -> 148950
A27: 6/2006 | D27: 0 | E27: 4000000 | F27: 0 | G27: 0 | H27: 13903000 | I27: =E27+H27 -> 17903000 | J27: 0 | K27: =($I$29+$J$29)/12 -> 16253222.791666666 | L27: =ROUND(IF(K27<8000000,0,IF(K27<=20000000,K27*0.1-800000,IF(K27<=50000000,K27*0.2-2800000,IF(K27<=80000000,K27*0.3-7800000,K27*40%-15800000)))),0) -> 825322 | M27: ='Tax paid-2005'!D25 -> 676371 | N27: =L27-M27 -> 148951
A29: Tổng cộng (Total) | D29: =SUM(D16:D28) -> 12000 | E29: =SUM(E16:E28) -> 47769740 | F29: =SUM(F16:F28) -> 3240 | G29: =SUM(G16:G28) -> 6300 | H29: =SUM(H16:H28) -> 147268933.5 | I29: =SUM(I16:I28) -> 195038673.5 | J29: =SUM(J16:J28) -> 0 | K29: =SUM(K16:K28) -> 195038673.49999997 | L29: =SUM(L16:L28) -> 9903864 | M29: =SUM(M16:M28) -> 7993172 | N29: =SUM(N16:N28) -> 1910692
M31: =SUM(M16:M21) -> 3973226
M32: =SUM(M22:M24) -> 1985726
M33: =SUM(M25:M27) -> 2034220